{
  "$schema": "./trace-model-routing-benchmark.schema.json",
  "schemaVersion": 1,
  "resultRoot": "target/trace-model-routing",
  "policies": [
    {"name": "sol-only", "enabled": true, "routes": {"discovery": ["gpt-5.6-sol/high"], "triage": ["gpt-5.6-sol/high"], "narrowFix": ["gpt-5.6-sol/high"], "sharedFix": ["gpt-5.6-sol/high"], "ordinaryVerify": ["gpt-5.6-sol/high"], "escalatedVerify": ["gpt-5.6-sol/high"]}},
    {"name": "terra-sol", "enabled": true, "routes": {"discovery": ["gpt-5.6-terra/low"], "triage": ["gpt-5.6-terra/medium", "gpt-5.6-sol/high"], "narrowFix": ["gpt-5.6-terra/medium", "gpt-5.6-sol/high"], "sharedFix": ["gpt-5.6-sol/high"], "ordinaryVerify": ["gpt-5.6-terra/medium"], "escalatedVerify": ["gpt-5.6-sol/high"]}},
    {"name": "luna-terra-sol", "enabled": false, "disabledReason": "Disabled until gpt-5.6-luna is a supported, observable worker route.", "routes": {"discovery": ["gpt-5.6-luna/low", "gpt-5.6-terra/low"], "triage": ["gpt-5.6-terra/medium", "gpt-5.6-sol/high"], "narrowFix": ["gpt-5.6-terra/medium", "gpt-5.6-sol/high"], "sharedFix": ["gpt-5.6-sol/high"], "ordinaryVerify": ["gpt-5.6-terra/medium"], "escalatedVerify": ["gpt-5.6-sol/high"]}}
  ],
  "cases": [
    {"id": "s1-lz2-monitor-break-narrow", "baseCommit": "5e3ba3ea3d6a609f98cd7662a0767bce21fef06c", "testClass": "com.openggf.tests.trace.s1.TestS1Lz2CompleteRunTraceReplay", "game": "s1", "zone": "lz2_completerun", "complexity": "narrow", "startingFrontier": {"frame": 6418, "field": "obj_s44_slot"}, "fixtures": [{"path": "src/test/resources/traces/s1/lz2_completerun/aux_state.jsonl.gz", "sha256": "37c55eefd2e271f2c0a13e9076db65dee8cd9d2b7a4e3b73351ac4f4e912a442"}, {"path": "src/test/resources/traces/s1/lz2_completerun/metadata.json", "sha256": "b88067e73039f1873d671909bfcb47b4686ac62d030872dc81d549911b86eda8"}, {"path": "src/test/resources/traces/s1/lz2_completerun/physics.csv.gz", "sha256": "2b15f5dbf67a8390519cdc2c96577a87f889f372d778038e7a0017528d27364e"}], "rom": {"property": "sonic1.rom.path", "sha1": "69E102855D4389C3FD1A8F3DC7D193F8EEE5FE5B"}, "targetCommand": "mvn -q -Dmse=off -Dsurefire.forkCount=1 -DreuseForks=true \"-Dsonic1.rom.path=<ROM_PATH>\" \"-Dtest=com.openggf.tests.trace.s1.TestS1Lz2CompleteRunTraceReplay#replayMatchesTrace\" test", "verificationClasses": ["com.openggf.tests.trace.s1.TestS1Ghz1TraceReplay"], "historicalFailureConfirmed": true},
    {"id": "s2-cnz-shared-sidekick-control", "baseCommit": "7fe4b63fa7f411515fe20c8dd5d1b5f9321d2b7f", "testClass": "com.openggf.tests.trace.s2.TestS2CnzLevelSelectTraceReplay", "game": "s2", "zone": "cnz", "complexity": "shared", "startingFrontier": {"frame": 202, "field": "tails_x"}, "fixtures": [{"path": "src/test/resources/traces/s2/cnz/aux_state.jsonl.gz", "sha256": "934688f8fca0aa542b2006df57c78ac10a6462966c9c09522c726ec0cf958e41"}, {"path": "src/test/resources/traces/s2/cnz/metadata.json", "sha256": "8e835d34dd104733b62901632819ceea92c93f1d6865660affdcfc8d48f62d4c"}, {"path": "src/test/resources/traces/s2/cnz/physics.csv.gz", "sha256": "062c27b4be97d7ec0a5a390aecdb46638fc30dae998563ffe3ba2262f1217fbf"}, {"path": "src/test/resources/traces/s2/cnz/s2-lvl-select-CNZ.bk2", "sha256": "fd84ccd7851d687b0ec2459152076b8a7bcb6f2a15c9bc2c72cdcef79d11db15"}], "rom": {"property": "sonic2.rom.path", "sha1": "8BCA5DCEF1AF3E00098666FD892DC1C2A76333F9"}, "targetCommand": "mvn -q -Dmse=off -Dsurefire.forkCount=1 -DreuseForks=true \"-Dsonic2.rom.path=<ROM_PATH>\" \"-Dtest=com.openggf.tests.trace.s2.TestS2CnzLevelSelectTraceReplay#replayMatchesTrace\" test", "verificationClasses": ["com.openggf.tests.trace.s2.TestS2Ehz1TraceReplay"], "historicalFailureConfirmed": true},
    {"id": "s3k-cnz-miniboss-arena-deep", "baseCommit": "cb74114a6c218d01454812666ef996529133608d", "testClass": "com.openggf.tests.trace.s3k.TestS3kCnzTraceReplay", "game": "s3k", "zone": "cnz", "complexity": "deep", "startingFrontier": {"frame": 14157, "field": "tails_x"}, "fixtures": [{"path": "src/test/resources/traces/s3k/cnz/aux_state.jsonl.gz", "sha256": "940e914b72e82699339c0d3e5f9332bc34b854a53e702501bb2a007e01f60c3b"}, {"path": "src/test/resources/traces/s3k/cnz/metadata.json", "sha256": "2061e8584cb638d7f1d33e5c48fd135289cda6eec5c09c6b36c25aa3ac028293"}, {"path": "src/test/resources/traces/s3k/cnz/physics.csv.gz", "sha256": "ec164de23f8404c4e16428965f9bf912b63a42b602ed49dc902544f209e4d492"}, {"path": "src/test/resources/traces/s3k/cnz/s3k-cnz-sonic-tails.bk2", "sha256": "09bd6fa87f41ed85113254f80c5cbadcc31bbdb43605389933e2836339c9c340"}], "rom": {"property": "s3k.rom.path", "sha1": "CFBF98C36C776677290A872547AC47C53D2761D6"}, "targetCommand": "mvn -q -Dmse=off -Dsurefire.forkCount=1 -DreuseForks=true \"-Dsurefire.argLine=-Xshare:off -Xmx6g\" \"-Ds3k.rom.path=<ROM_PATH>\" \"-Dtest=com.openggf.tests.trace.s3k.TestS3kCnzTraceReplay#replayMatchesTrace\" test", "verificationClasses": ["com.openggf.tests.TestS3kAiz1SkipHeadless", "com.openggf.tests.TestSonic3kLevelLoading", "com.openggf.game.sonic3k.TestSonic3kBootstrapResolver", "com.openggf.game.sonic3k.TestSonic3kDecodingUtils"], "historicalFailureConfirmed": true}
  ]
}
